{
  "$schema": "https://json-schema.org/draft/2020-12/schema",
  "$id": "pancreator://stage/v1",
  "title": "Pancreator workflow stage",
  "description": "One stage file at library/workflows/<slug>/stages/<stage-slug>.json. A stage is one unit of delegated work with a persona, a task prompt, a workspace mutation policy, a gate, a declared output shape, criteria, and transitions.",
  "type": "object",
  "required": [
    "slug",
    "title",
    "persona",
    "prompt_path",
    "workspace_policy",
    "gate",
    "context",
    "criteria",
    "transitions"
  ],
  "additionalProperties": false,
  "properties": {
    "slug": {
      "type": "string",
      "pattern": "^[a-z0-9-]+$",
      "description": "Stage identifier, unique within the workflow. Must match the file name and appear in the workflow index stages[]."
    },
    "title": {
      "type": "string",
      "minLength": 1,
      "description": "Human-readable stage name shown on invocation cards and records."
    },
    "persona": {
      "type": "string",
      "pattern": "^[a-z0-9-]+$",
      "description": "Owner of the stage. Resolves to library/personas/<persona>.md and, for delegated work, to the matching .cursor/agents/pan-<persona>.md subagent."
    },
    "persona_by_verdict": {
      "type": "object",
      "description": "Verdict-conditional persona selection. When the latest output of source_stage carries a mapped verdict, the stage runs under the mapped persona instead of its default persona. Run creation validates and snapshots every mapped persona.",
      "required": ["source_stage", "path", "map"],
      "additionalProperties": false,
      "properties": {
        "source_stage": {
          "type": "string",
          "pattern": "^[a-z0-9-]+$",
          "description": "Stage whose latest output supplies the verdict. MUST name another stage in the same workflow."
        },
        "path": {
          "type": "string",
          "description": "Dotted path inside the source output's data object, for example 'verify.verdict'."
        },
        "map": {
          "type": "object",
          "minProperties": 1,
          "description": "Verdict value to persona name. An unmapped or unreadable verdict keeps the stage's default persona.",
          "additionalProperties": {
            "type": "string",
            "pattern": "^[a-z0-9-]+$"
          }
        }
      }
    },
    "evidence_workers": {
      "type": "array",
      "minItems": 1,
      "description": "Parallel evidence workers the supervisor launches top-level before the stage worker. Each writes one evidence report the stage worker consolidates; submission rejects the stage output while a report is missing.",
      "items": {
        "type": "object",
        "required": ["persona", "role", "scope"],
        "additionalProperties": false,
        "properties": {
          "persona": {
            "type": "string",
            "pattern": "^[a-z0-9-]+$",
            "description": "Persona whose projected agent and model mapping the worker runs under."
          },
          "role": {
            "type": "string",
            "pattern": "^[a-z][a-z0-9-]*$",
            "not": { "enum": ["worker", "supervisor"] },
            "description": "Unique evidence dimension slug, for example 'review' or 'qa'. Reserved CLI roles 'worker' and 'supervisor' are forbidden."
          },
          "scope": {
            "type": "string",
            "minLength": 1,
            "description": "Scope statement rendered into the generated evidence brief."
          },
          "return_scope": {
            "type": "string",
            "minLength": 1,
            "description": "Scope used instead of scope on a return visit after remediation, and as this dimension's scope on a scoped return visit. Absent means scope applies on every visit."
          },
          "run_when": {
            "enum": ["live_criteria"],
            "description": "Condition for launching the worker. live_criteria launches it only when an acceptance criterion of the run has proof live, or when no criterion proof can be read. The harness records a skipped worker on the invocation and renders the reason on the stage worker's card. Absent means the worker always runs."
          }
        }
      }
    },
    "scoped_return": {
      "type": "object",
      "description": "A return visit that serves a small remediation runs the stage worker alone, covering each listed evidence dimension in its own output. The harness decides from the preceding remediation's changed paths and the verdict that routed it; a first visit, a fail_severe return, a path matching excluded_path_globs, a deleted test, or a stage declaring evidence roles beyond dimensions keeps the full topology.",
      "required": ["max_paths", "max_findings", "dimensions"],
      "additionalProperties": false,
      "properties": {
        "max_paths": {
          "type": "integer",
          "minimum": 1,
          "description": "Most paths the preceding remediation may have changed."
        },
        "max_findings": {
          "type": "integer",
          "minimum": 1,
          "description": "Most findings the routing verdict may carry."
        },
        "excluded_path_globs": {
          "type": "array",
          "items": {
            "type": "string",
            "minLength": 1
          },
          "description": "A changed path matching one of these keeps the full topology."
        },
        "dimensions": {
          "type": "array",
          "minItems": 1,
          "items": {
            "type": "string"
          },
          "description": "Evidence roles the stage worker covers on a scoped visit. Each MUST be a role evidence_workers declares."
        }
      }
    },
    "executor": {
      "enum": ["agent", "harness"],
      "description": "Execution mode. agent delegates to a worker persona. harness runs deterministic runtime logic without delegation."
    },
    "prompt_path": {
      "type": "string",
      "description": "Repository-relative path to the stage task brief. Its contents become the Task section of the invocation card."
    },
    "workspace_policy": {
      "enum": [
        "source_allowed",
        "release_metadata_only",
        "runtime_only",
        "read_only"
      ],
      "description": "Declared mutation expectation. source_allowed may modify product source. release_metadata_only identifies expected self-development release files. runtime_only and read_only normally avoid tracked target changes. For every non-source_allowed stage, scope.no_unapproved_changes detects external or unattributed contamination; worker-attributed internal changes remain visible evidence but do not block."
    },
    "gate": {
      "enum": ["operator", "supervisor", "next_stage", "stage_verdict"],
      "description": "What decides advancement after a successful output. operator: pause for explicit operator approval (intake, ship). supervisor: pause for independent supervisor judgment of the judgment criteria (plan). stage_verdict: the worker's own verdict drives the transition (review, test). next_stage: advance directly to the success transition (implement). An operator-involvement profile MAY replace this gate for a run unless gate_relaxable is false."
    },
    "gate_relaxable": {
      "type": "boolean",
      "description": "Whether an operator-involvement profile MAY lower this stage's gate. Defaults to true. Set false only where a policy requires the pause to survive configuration, as SHIP-001 does for dev/ship."
    },
    "checkpoint": {
      "enum": ["technical_plan", "independent_review"],
      "description": "Role this stage plays for run contracts that attach across workflows. The technical_director contract escalates gates by checkpoint rather than by stage slug, so it applies unchanged to dev/plan, prototype/approach, and design/review. At most one stage per workflow MAY declare a given checkpoint."
    },
    "context": {
      "type": "object",
      "description": "Stage-scoped context projection. Required inputs are read before work; conditional references are opened only on their declared trigger; omitted history remains discoverable through a generated context manifest.",
      "required": ["request"],
      "additionalProperties": false,
      "properties": {
        "request": {
          "enum": ["required", "conditional", "omit"],
          "description": "Whether the original operator request is a required input, a fallback reference, or omitted from the stage card."
        },
        "required_stage_outputs": {
          "type": "array",
          "description": "Effective stage outputs the worker must read. Missing selectors are surfaced explicitly on the invocation card.",
          "items": {
            "$ref": "#/$defs/contextStageSelector"
          }
        },
        "conditional_stage_outputs": {
          "type": "array",
          "description": "Stage outputs that remain available but should be read only when required inputs do not resolve the task or unresolved remediation evidence requires them.",
          "items": {
            "$ref": "#/$defs/contextStageSelector"
          }
        },
        "prior_attempts": {
          "type": "integer",
          "minimum": 0,
          "description": "Maximum prior attempts of the current stage to include as required remediation context."
        },
        "operator_feedback": {
          "type": "integer",
          "minimum": 0,
          "description": "Maximum recent non-approval remediation notes targeting this stage. Every approval directive targeting the stage remains required input."
        },
        "include_workspace_ratifications": {
          "type": "boolean",
          "description": "Include the latest operator workspace ratification matching the current fingerprint."
        },
        "gate_evidence": {
          "type": "boolean",
          "description": "Include a reference to the passed evidence of each repository-check profile a harness gate or baseline already ran, carrying the profile and the workspace fingerprint it passed at, so evidence workers cite the gate instead of re-executing the profile."
        },
        "suite_profile": {
          "type": "boolean",
          "description": "Include the advisory suite profile the run's last full-profile gate recorded, with its delta against the previous succeeded run in the same workspace. Advisory only; never a gate."
        }
      }
    },
    "required_data": {
      "type": "object",
      "description": "Shape contract for the output's data object, as a map of dotted paths to expected JSON types. The harness rejects an output whose data does not match. Type is one of: object, array, string, number, boolean.",
      "additionalProperties": {
        "enum": ["object", "array", "string", "number", "boolean"]
      }
    },
    "blocked_required_data": {
      "type": "object",
      "description": "Shape contract for a blocked result's data object, replacing required_data on that result. A blocked stage reports the precondition it lacked and the command that supplies it, and owes none of the product fields it never produced. Every declared string field must be non-empty.",
      "additionalProperties": {
        "enum": ["object", "array", "string", "number", "boolean"]
      }
    },
    "criteria": {
      "type": "array",
      "minItems": 1,
      "description": "Checkable claims for this stage. See governance/criteria/index.md for naming and families.",
      "items": {
        "type": "object",
        "required": ["id", "type", "statement"],
        "additionalProperties": false,
        "properties": {
          "id": {
            "type": "string",
            "pattern": "^[a-z0-9_.-]+$",
            "description": "Namespaced identifier <area>.<claim>, stable across history."
          },
          "type": {
            "enum": ["judgment", "shell", "state"],
            "description": "judgment: evaluated by a reasoning agent. shell: harness reruns command. state: harness checks run state and fingerprints."
          },
          "hard": {
            "type": "boolean",
            "description": "If true, failure or not_applicable blocks the stage. Defaults to false."
          },
          "statement": {
            "type": "string",
            "minLength": 1,
            "description": "The claim, phrased so that pass is unambiguous."
          },
          "command": {
            "type": "string",
            "description": "Required for type=shell. The exact command the harness reruns; never assembled from agent-controlled values."
          },
          "timeout_ms": {
            "type": "integer",
            "minimum": 1,
            "description": "Optional timeout for a shell criterion. Defaults to 120000."
          }
        },
        "allOf": [
          {
            "if": {
              "properties": {
                "type": {
                  "const": "shell"
                }
              }
            },
            "then": {
              "required": ["command"]
            }
          }
        ]
      }
    },
    "transitions": {
      "type": "object",
      "description": "Outcome routing. Targets are either another stage slug or a terminal status (succeeded, failed, canceled, paused).",
      "required": ["success", "failure", "blocked"],
      "additionalProperties": false,
      "properties": {
        "success": {
          "type": "string",
          "description": "Target after a successful, gated outcome."
        },
        "failure": {
          "type": "string",
          "description": "Remediation target after a failed outcome (often the implement stage)."
        },
        "blocked": {
          "type": "string",
          "description": "Target when the worker reports a blocker; usually 'paused'."
        }
      }
    },
    "entry_gate": {
      "type": "object",
      "description": "A shell criterion of this stage the harness runs when the run enters the stage, before it delegates the worker. A failure routes to `failure`, whose success transition returns here while that route is open. After `max_loops` consecutive failures the next failure pauses the run for an operator decision that away mode cannot take. The ship stage declares the full profile here as its release gate.",
      "required": ["criterion", "failure", "max_loops"],
      "additionalProperties": false,
      "properties": {
        "criterion": {
          "type": "string",
          "description": "Id of a shell criterion declared in this stage's criteria."
        },
        "failure": {
          "type": "string",
          "pattern": "^[a-z0-9-]+$",
          "description": "Stage a gate failure routes to; must be another stage of the workflow."
        },
        "max_loops": {
          "type": "integer",
          "minimum": 0,
          "description": "Consecutive gate failures that route to `failure` before the next failure pauses for the operator."
        }
      }
    }
  },
  "$defs": {
    "contextStageSelector": {
      "type": "object",
      "required": ["stage", "selection"],
      "additionalProperties": false,
      "properties": {
        "stage": {
          "type": "string",
          "pattern": "^[a-z0-9-]+$"
        },
        "selection": {
          "enum": ["latest", "latest_success"],
          "description": "latest selects the newest attempt regardless of outcome; latest_success selects the newest successful attempt."
        }
      }
    }
  }
}
