{
  "slug": "remediate",
  "title": "Remediation",
  "persona": "remediator",
  "persona_by_verdict": {
    "source_stage": "verify",
    "path": "verify.verdict",
    "map": {
      "fail_severe": "remediator-severe"
    }
  },
  "prompt_path": "library/workflows/delivery/prompts/remediate.md",
  "workspace_policy": "source_allowed",
  "gate": "next_stage",
  "context": {
    "request": "required",
    "required_stage_outputs": [
      {
        "stage": "verify",
        "selection": "latest"
      }
    ],
    "conditional_stage_outputs": [
      {
        "stage": "implement",
        "selection": "latest"
      }
    ],
    "prior_attempts": 1,
    "operator_feedback": 1
  },
  "required_data": {
    "implementation": "object",
    "implementation.changed_files": "array",
    "implementation.tests_added": "array",
    "implementation.notes": "array",
    "implementation.remediation": "array",
    "acceptance_results": "array"
  },
  "criteria": [
    {
      "id": "remediate.addresses_verdict",
      "type": "judgment",
      "hard": true,
      "statement": "The remediation addresses every recorded failure that routed the run here: each blocking verify finding, failed acceptance criterion, and failed QA case, or the failed release-gate result, or records why one stands."
    },
    {
      "id": "implement.acceptance_claimed",
      "type": "judgment",
      "hard": true,
      "statement": "The output maps evidence to every acceptance criterion and does not claim unsupported completion."
    },
    {
      "id": "implement.lint",
      "type": "shell",
      "hard": true,
      "statement": "Configured repository static checks pass.",
      "command": "pan repository-check static",
      "timeout_ms": 240000
    },
    {
      "id": "configuration.valid",
      "type": "shell",
      "hard": true,
      "statement": "Repository configuration and governance validate.",
      "command": "pan repository-check configuration",
      "timeout_ms": 240000
    },
    {
      "id": "implement.impacted_integration",
      "type": "shell",
      "hard": true,
      "statement": "The integration tests the change reaches pass, so verify sees every lane the ship gate can fail on.",
      "command": "pan repository-check impacted-integration",
      "timeout_ms": 900000
    }
  ],
  "transitions": {
    "success": "verify",
    "failure": "remediate",
    "blocked": "paused"
  }
}
